{
    "catalog_number": "1756-EN",
    "class_name": "AB_1736_ENT",
    "vendor": "Allen Bradley",
    "controls_type": "RACK_COMM_CARD",
    "metadata": {
        "vendor": "Allen Bradley",
        "description": "Allen Bradley 1756-EN*T Chassis Communications Module.",
        "created_date": "2025-12-2"
    }
}